<?xml version="1.0" encoding="UTF-8"?>
<xs:schema xmlns:xs="http://www.w3.org/2001/XMLSchema">

    <xs:element name="order">
        <xs:complexType>
            <xs:sequence>
                <xs:element name="customerDetails">
                    <xs:complexType>
                        <xs:sequence>
                            <xs:element name="name" type="xs:string"/>
                            <xs:element name="address" type="xs:string"/>
                        </xs:sequence>
                    </xs:complexType>
                </xs:element>
                <xs:element name="items">
                    <xs:complexType>
                        <xs:sequence>
                            <xs:element name="item" maxOccurs="unbounded">
                                <xs:complexType>
                                    <xs:sequence>
                                        <xs:element name="productID" type="xs:string"/>
                                        <xs:element name="quantity" type="xs:int"/>
                                    </xs:sequence>
                                </xs:complexType>
                            </xs:element>
                        </xs:sequence>
                    </xs:complexType>
                </xs:element>
                <xs:element name="totalCost" type="xs:decimal"/>
            </xs:sequence>
        </xs:complexType>
    </xs:element>

</xs:schema>
